,name,main_speaker,views,comments,Funny,Beautiful,Ingenious,Courageous,Longwinded,Confusing,Informative,Fascinating,Unconvincing,Persuasive,Jawdrop,Ok,Obnoxious,Inspiring
1188,Elizabeth Nyamayaro: An invitation to men who want a better world for women,Elizabeth Nyamayaro,1272389,68,117,147,112,294,113,70,38,12,12,11,8,10,6,13
1189,Jamie Bartlett: How the mysterious dark net is going mainstream,Jamie Bartlett,2061368,109,1057,601,163,39,151,73,170,8,115,104,48,20,3,13
1190,Jim Simons: The mathematician who cracked Wall Street,Jim Simons,1705702,57,246,34,74,17,168,193,18,23,13,15,10,43,10,5
1191,Alan Eustace: I leapt from the stratosphere. Here's how I did it,Alan Eustace,1437261,80,297,105,251,185,67,108,57,58,19,3,6,11,9,8
1192,Barry Schwartz: The way we think about work is broken,Barry Schwartz,2527133,97,392,526,287,73,215,135,218,38,51,70,18,67,38,17
1193,BJ Miller: What really matters at the end of life,BJ Miller,6214152,244,2462,612,3028,29,1331,74,409,418,96,78,131,29,24,15
1194,Billie Jean King: This tennis icon paved the way for women in sports,Billie Jean King,947562,21,61,47,111,29,22,20,22,12,7,1,1,7,1,0
1195,David Rothkopf: How fear drives American politics,David Rothkopf,1215662,74,92,44,310,21,228,75,16,13,162,9,96,26,19,10
1196,Mia Birdsong: The story we tell about poverty isn't true,Mia Birdsong,1612561,64,371,208,638,196,33,57,13,50,157,21,34,9,14,15
1197,Michael Kimmel: Why gender equality is good for everyone ??? men included,Michael Kimmel,1447861,164,55,45,148,438,581,156,391,306,98,76,70,38,6,76
1198,Mandy Len Catron: Falling in love is the easy part,Mandy Len Catron,3098476,149,277,429,380,94,431,319,255,430,87,36,71,41,24,36
1199,Scott Dinsmore: How to find work you love,Scott Dinsmore,4811180,181,2684,503,597,127,85,173,82,31,302,347,99,258,82,73
1200,Sakena Yacoobi: How I stopped the Taliban from shutting down my school,Sakena Yacoobi,1371548,77,233,684,180,32,322,716,100,183,71,27,5,5,2,1
1201,Frances Larson: Why public beheadings get millions of views,Frances Larson,1108371,90,42,82,20,194,79,31,8,50,18,36,31,19,19,6
1202,Mary Robinson: Why climate change is a threat to human rights,Mary Robinson,1126459,128,54,79,176,196,14,118,23,12,32,28,52,12,18,12
1203,Robin Morgan: 4 powerful poems about Parkinson's and growing older,Robin Morgan,1004539,12,245,91,6,109,28,26,15,4,9,4,5,1,14,3
1204,Samuel Cohen: Alzheimer's is not normal aging ??? and we can cure it,Samuel Cohen,1506693,120,628,338,284,70,27,109,31,19,70,32,9,4,3,3
1205,"Taiye Selasi: Don't ask where I'm from, ask where I'm a local",Taiye Selasi,2141928,162,1128,338,248,26,273,66,504,39,388,14,114,32,30,13
1206,Mac Stone: Stunning photos of the endangered Everglades,Mac Stone,1155507,32,77,318,131,337,163,188,12,28,18,2,3,5,9,6
1207,Martin Pistorius: How my mind came back to life ??? and no one knew,Martin Pistorius,2094497,76,1035,608,126,254,216,367,19,25,4,39,3,9,0,0
1208,Emilie Wapnick: Why some of us don't have one true calling,Emilie Wapnick,4456309,489,4572,1118,927,704,525,34,65,24,932,152,531,277,196,14
1209,Alice Bows-Larkin: Climate change is happening. Here's how we adapt,Alice Bows-Larkin,1158020,164,291,137,44,69,20,20,20,29,19,6,44,51,16,33
1210,"Siddhartha Mukherjee: Soon we'll cure diseases with a cell, not a pill",Siddhartha Mukherjee,1294952,42,316,19,20,76,143,174,79,8,23,47,11,14,11,5
1211,Neri Oxman: Design at the intersection of technology and biology,Neri Oxman,1607427,75,267,368,478,266,180,209,17,12,20,22,29,21,10,9
1212,Sandrine Thuret: You can grow new brain cells. Here's how,Sandrine Thuret,4615013,155,45,2265,1533,413,185,90,48,144,176,658,134,19,27,6
1213,Teitur: Home is a song I've always remembered,Teitur,1034518,38,306,110,54,30,5,5,6,6,3,12,14,11,6,4
1214,Michael Green: How we can make the world a better place by 2030,Michael Green,1141254,76,421,413,151,40,38,84,117,15,3,15,43,30,16,9
1215,Vijay Kumar: The future of flying robots,Vijay Kumar,1349253,37,147,268,243,244,67,151,45,16,43,4,7,4,8,3
1216,Alyson McGregor: Why medicine often has dangerous side effects for women,Alyson McGregor,1414721,115,678,41,237,7,20,9,179,54,151,47,66,38,34,10
1217,Anders Fjellberg: Two nameless bodies washed up on the beach. Here are their stories,Anders Fjellberg,1220746,45,222,304,198,77,72,82,40,36,8,3,1,10,7,6
1218,Meklit Hadero: The unexpected beauty of everyday sounds,Meklit Hadero,996127,50,500,268,317,26,64,85,64,40,24,5,8,10,9,1
1219,Will Potter: The secret US prisons you've never heard of before,Will Potter,2507956,126,618,569,177,215,127,40,37,55,106,13,21,13,20,6
1220,Jennifer Doudna: How CRISPR lets us edit our DNA,Jennifer Doudna,1936760,217,145,103,78,583,183,18,52,155,453,148,5,15,15,12
1221,Tea Uglow: An Internet without screens might look like this,Tea Uglow,1613847,43,266,245,115,68,45,89,111,83,46,61,26,17,16,4
1222,"Francesco Sauro: Deep under the Earth's surface, discovering beauty and science",Francesco Sauro,1418492,22,355,63,253,162,46,68,24,2,41,19,12,11,19,9
1223,Hilary Cottam: Social services are broken. How we can fix them,Hilary Cottam,684300,80,289,14,12,185,131,30,16,8,11,38,14,29,43,1
1224,Cesar Harada: How I teach kids to love science,Cesar Harada,1625784,57,217,175,81,64,421,116,36,73,44,22,7,9,7,0
1225,Christine Sun Kim: The enchanting music of sign language,Christine Sun Kim,1242903,37,383,344,84,17,183,207,69,28,7,37,21,6,0,0
1226,Mathias Jud: Art that lets you talk back to NSA spies,Mathias Jud,958480,30,62,61,100,84,114,42,15,28,10,12,12,5,16,35
1227,Daniel Levitin: How to stay calm when you know you'll be stressed,Daniel Levitin,9163813,129,341,100,479,1175,359,290,365,194,115,34,109,76,64,40
1228,Nancy Lublin: How data from a crisis text line is saving lives,Nancy Lublin,780116,32,188,41,411,88,15,122,153,71,62,40,24,5,0,0
1229,Melissa Fleming: A boat carrying 500 refugees sunk at sea. The story of two survivors,Melissa Fleming,1502400,70,377,20,166,160,481,220,28,13,17,64,67,19,7,10
1230,Patr?_cia Medici: The coolest animal you know nothing about ... and how we can save it,Patr?_cia Medici,1296514,56,128,248,154,239,11,59,171,961,93,8,23,4,7,10
1231,Harald Haas: Forget Wi-Fi. Meet the new Li-Fi Internet,Harald Haas,1879260,102,557,275,182,323,369,11,39,35,4,42,66,9,13,13
1232,Kaki King: A musical escape into a world of light and color,Kaki King,1365169,44,143,147,317,64,81,13,44,36,16,3,9,9,16,3
1233,Jenni Chang and Lisa Dazols: This is what LGBT life is like around the world,Jenni Chang and Lisa Dazols,1609136,50,180,277,255,199,29,42,12,36,20,24,5,5,8,8
1234,Andreas Ekstr?m: The moral bias behind your search results,Andreas Ekstr?m,1396735,57,92,463,144,147,187,41,46,13,51,10,20,20,19,13
1235,Chelsea Shields: How I'm working for change inside my church,Chelsea Shields,1452861,303,42,134,60,116,228,232,22,141,50,101,50,43,7,21
1236,Jean-Paul Mari: The chilling aftershock of a brush with death,Jean-Paul Mari,762041,46,164,135,86,49,114,25,11,6,20,19,17,30,5,3
1237,Josh Luber: Why sneakers are a great investment,Josh Luber,1799799,75,221,394,319,96,21,31,31,62,45,50,54,8,15,13
1238,Nonny de la Pe?a: The future of news? Virtual reality,Nonny de la Pe?a,1202223,49,169,58,30,81,60,38,28,83,7,48,27,6,8,3
1239,Anote Tong: My country will be underwater soon -- unless we work together,Anote Tong,1054718,65,11,59,8,75,115,65,8,12,32,14,5,24,10,3
1240,Carl Safina: What are animals thinking and feeling?,Carl Safina,1976994,149,889,596,515,43,537,18,744,36,110,26,95,56,23,24
1241,Genevieve von Petzinger: Why are these 32 symbols found in ancient caves all over Europe?,Genevieve von Petzinger,3436514,81,189,63,158,461,435,66,50,111,28,28,17,22,13,11
1242,Ann Morgan: My year reading a book from every country in the world,Ann Morgan,1446267,63,212,548,122,178,234,11,5,16,71,37,66,18,26,12
1243,Regina Hartley: Why the best hire might not have the perfect resume,Regina Hartley,3185521,160,2036,634,240,135,598,96,297,262,168,35,15,19,49,21
1244,"Marina Abramovi??: An art made of trust, vulnerability and connection",Marina Abramovi??,1626686,37,316,149,358,185,10,30,15,23,27,11,34,8,38,38
1245,Kristen Marhaver: How we're growing baby corals to rebuild reefs,Kristen Marhaver,729236,21,193,233,229,29,168,12,78,19,5,16,0,0,0,0
1246,Jessica Shortall: The US needs paid family leave -- for the sake of its future,Jessica Shortall,1392660,219,241,275,239,180,43,58,29,12,37,30,7,4,15,2
1247,Chieko Asakawa: How new technology helps blind people explore the world,Chieko Asakawa,1201029,46,143,238,68,89,55,26,76,9,6,9,34,9,2,4
1248,Guillaume N?ry: The exhilarating peace of freediving,Guillaume N?ry,857839,36,121,220,261,78,195,84,9,46,7,6,6,5,11,2
1249,Jedidah Isler: The untapped genius that could change science for the better,Jedidah Isler,1049263,28,101,141,252,20,92,36,15,39,10,11,19,28,7,5
1250,Danit Peleg: Forget shopping. Soon you'll download your new clothes,Danit Peleg,1582286,75,44,159,35,27,146,175,116,122,99,29,30,13,11,10
1251,Raymond Wang: How germs travel on planes -- and how we can stop them,Raymond Wang,1690995,76,359,285,173,100,134,4,19,62,7,15,23,7,8,5
1252,Nicole Paris and Ed Cage: A beatboxing lesson from a father-daughter duo,Nicole Paris and Ed Cage,2852664,35,210,49,11,86,71,106,52,13,43,57,10,9,17,4
1253,Paul Greenberg: The four fish we're overeating -- and what to eat instead,Paul Greenberg,1488694,69,478,163,32,159,232,9,22,17,27,14,2,3,22,6
1254,Lucianne Walkowicz: Let's not use Mars as a backup planet,Lucianne Walkowicz,2004123,147,43,9,76,370,267,347,292,102,46,106,35,39,75,13
1255,Alison Killing: What happens when a city runs out of room for its dead,Alison Killing,1453242,37,224,61,23,12,86,69,18,12,16,17,24,12,6,6
1256,Jane Fonda and Lily Tomlin: A hilarious celebration of lifelong female friendship,Jane Fonda and Lily Tomlin,2269844,52,122,121,477,57,275,51,64,367,22,26,25,18,12,4
1257,Ant?_nio Guterres: Refugees have the right to be protected,Ant?_nio Guterres,1117165,88,91,213,147,39,112,4,28,31,12,11,33,10,8,5
1258,Rodrigo Bijou: Governments don't understand cyber warfare. We need hackers,Rodrigo Bijou,1254964,39,316,21,122,68,72,14,52,74,76,9,31,17,14,11
1259,"Jason deCaires Taylor: An underwater art museum, teeming with life",Jason deCaires Taylor,1446673,44,492,114,334,191,88,50,105,9,16,7,24,27,14,17
1260,Robert Waldinger: What makes a good life? Lessons from the longest study on happiness,Robert Waldinger,16601927,527,8590,1661,3825,2868,2564,217,368,251,259,130,31,25,140,119
1261,Harry Cliff: Have we reached the end of physics?,Harry Cliff,2291444,167,529,100,69,389,25,23,26,119,70,26,57,42,11,11
1262,Sebastian Wernicke: How to use data to make a hit TV show,Sebastian Wernicke,1468497,45,86,471,196,48,30,97,114,150,15,29,21,35,8,4
1263,Aomawa Shields: How we'll find life on other planets,Aomawa Shields,1526242,92,284,270,27,156,176,34,34,99,26,25,11,8,30,16
1264,David Sedlak: 4 ways we can avoid a catastrophic drought,David Sedlak,1013976,43,265,109,16,9,95,10,10,37,1,37,9,26,4,1
1265,James Veitch: This is what happens when you reply to spam email,James Veitch,20475972,150,7731,1766,939,401,221,240,143,229,45,63,60,417,91,20
1266,Tim Harford: How frustration can make us more creative,Tim Harford,2435682,48,184,336,865,82,326,116,300,34,78,7,25,18,11,22
1267,"Melvin Russell: I love being a police officer, but we need reform",Melvin Russell,982439,96,138,282,154,31,118,92,18,19,35,41,6,20,6,2
1268,Wael Ghonim: Let's design social media that drives real change,Wael Ghonim,1286663,67,129,210,193,191,306,43,7,16,10,25,37,7,19,6
1269,Ole Scheeren: Why great architecture should tell a story,Ole Scheeren,2079266,72,256,342,390,36,212,174,9,17,32,10,40,12,44,6
1270,Jill Heinerth: The mysterious world of underwater caves,Jill Heinerth,1468644,25,222,271,60,138,16,93,18,67,50,13,12,11,17,0
1271,Jill Farrant: How we can make crops survive without water,Jill Farrant,1332162,52,102,249,26,92,148,86,55,9,8,11,6,41,6,6
1272,Oscar Schwartz: Can a computer write poetry?,Oscar Schwartz,764500,90,82,148,117,133,6,17,44,46,16,34,17,41,23,19
1273,Achenyo Idachaba: How I turned a deadly plant into a thriving business,Achenyo Idachaba,1716203,56,72,145,89,186,390,118,7,122,27,4,4,4,1,0
1274,Elizabeth Lev: The unheard story of the Sistine Chapel,Elizabeth Lev,1477852,44,384,354,258,152,18,21,10,7,35,54,18,45,38,7
1275,Yanis Varoufakis: Capitalism will eat democracy -- unless we speak up,Yanis Varoufakis,2269380,299,130,382,348,644,447,128,353,64,108,33,31,25,39,22
1276,David Gruber: Glow-in-the-dark sharks and other stunning sea creatures,David Gruber,1853424,19,276,215,333,87,7,4,74,21,17,9,11,9,10,4
1277,Tania Simoncelli: Should you be able to patent a human gene?,Tania Simoncelli,1059854,64,183,6,172,30,49,38,117,29,72,23,9,7,9,5
1278,Auke Ijspeert: A robot that runs and swims like a salamander,Auke Ijspeert,1805637,24,167,94,49,31,71,120,34,13,16,6,14,2,7,7
1279,Melati and Isabel Wijsen: Our campaign to ban plastic bags in Bali,Melati and Isabel Wijsen,1219306,105,721,10,242,69,175,127,61,3,81,33,37,33,14,4
1280,Linda Liukas: A delightful way to teach kids about computers,Linda Liukas,1617536,67,38,331,69,501,42,27,190,129,31,139,89,66,63,14
1281,Andr?s Ruzo: The boiling river of the Amazon,Andr?s Ruzo,1198546,42,462,322,34,20,275,413,67,29,58,9,90,5,32,17
1282,Judson Brewer: A simple way to break a bad habit,Judson Brewer,8107178,129,1987,887,172,1209,673,55,126,223,241,60,48,36,51,4
1283,Pardis Sabeti: How we'll fight the next deadly virus,Pardis Sabeti,1169214,20,90,66,152,105,69,29,5,9,6,17,4,1,0,0
1284,Matthew Williams: Special Olympics let me be myself -- a champion,Matthew Williams,1074684,38,281,379,64,108,124,2,4,16,8,16,30,1,6,2
1285,Dambisa Moyo: Economic growth has stalled. Let's fix it,Dambisa Moyo,1440785,169,126,20,81,35,36,135,16,62,35,13,74,18,22,1
1286,Sean Follmer: Shape-shifting tech will change work as we know it,Sean Follmer,1406128,58,65,30,345,209,120,186,205,41,27,39,20,11,5,7
1287,Gregory Heyworth: How I'm discovering the secrets of ancient texts,Gregory Heyworth,761052,36,241,115,246,20,72,42,30,2,11,30,4,12,1,0
1288,Mike Velings: The case for fish farming,Mike Velings,1184159,110,318,87,150,150,12,13,6,20,8,28,12,13,10,13
1289,Dorothy Roberts: The problem with race-based medicine,Dorothy Roberts,1008812,114,248,84,24,52,93,40,45,81,47,25,20,9,18,3
1290,Jocelyne Bloch: The brain may be able to repair itself -- with help,Jocelyne Bloch,2152900,102,444,172,448,117,218,44,35,47,12,6,1,4,59,10
1291,Celeste Headlee: 10 ways to have a better conversation,Celeste Headlee,8444981,215,1494,531,1843,1754,3599,30,1704,2853,199,38,200,115,35,26
1292,Shonda Rhimes: My year of saying yes to everything,Shonda Rhimes,3148366,143,1121,573,2010,127,199,43,64,234,300,88,359,95,101,126
1293,Allan Adams: What the discovery of gravitational waves means,Allan Adams,2233265,150,175,299,531,472,35,83,20,20,91,98,28,40,34,43
1294,Raffaello D'Andrea: Meet the dazzling flying machines of the future,Raffaello D'Andrea,2560359,61,468,676,366,278,319,318,26,98,8,25,9,26,16,8
1295,Al Gore: The case for optimism on climate change,Al Gore,1624248,362,233,719,956,17,234,496,22,176,34,101,50,34,12,18
1296,Dalia Mogahed: What it's like to be Muslim in America,Dalia Mogahed,2520181,422,1774,1845,1152,647,485,77,358,120,70,26,129,58,22,57
1297,Audrey Choi: How to make a profit while making a difference,Audrey Choi,1677370,17,94,145,134,22,51,156,32,9,30,5,6,3,7,7
1298,Mary Bassett: Why your doctor should care about social justice,Mary Bassett,1072558,57,98,21,42,14,3,10,82,48,66,18,14,6,5,3
1299,Ivan Coyote: Why we need gender-neutral bathrooms,Ivan Coyote,1546530,184,278,16,233,374,317,77,27,137,77,48,177,26,39,24
1300,Thomas Peschak: Dive into an ocean photographer's world,Thomas Peschak,901880,36,540,357,113,128,274,5,74,2,44,16,7,8,4,7
1301,Magda Sayeg: How yarn bombing grew into a worldwide movement,Magda Sayeg,1260939,26,164,43,128,78,28,43,19,47,19,19,4,9,5,2
1302,Russ Altman: What really happens when you mix medications?,Russ Altman,1587090,68,581,146,241,123,105,42,33,18,7,12,11,36,8,8
1303,Alexander Betts: Our refugee system is failing. Here's how we can fix it,Alexander Betts,823110,139,209,392,477,250,81,59,79,29,18,20,15,8,61,30
1304,Travis Kalanick: Uber's plan to get more people into fewer cars,Travis Kalanick,1587546,171,320,100,160,190,106,66,53,40,31,10,13,14,21,29
1305,"Reshma Saujani: Teach girls bravery, not perfection",Reshma Saujani,3325490,138,1426,570,2273,425,659,373,24,18,79,27,79,70,12,27
1306,Caleb Harper: This computer will grow your food in the future,Caleb Harper,1589527,83,192,318,503,38,371,232,33,69,68,27,104,7,17,17
1307,Laura Robinson: The secrets I find on the mysterious ocean floor,Laura Robinson,1487112,28,139,41,164,9,84,8,45,5,1,4,9,4,14,0
1308,Mileha Soneji: Simple hacks for life with Parkinson's,Mileha Soneji,854226,50,142,115,294,171,120,22,22,29,4,11,11,1,2,3
1309,Tshering Tobgay: This country isn't just carbon neutral -- it's carbon negative,Tshering Tobgay,1954438,89,876,1589,415,221,52,59,99,309,375,96,27,9,9,6
1310,Casey Gerald: The gospel of doubt,Casey Gerald,1399811,120,656,1099,497,102,306,83,50,18,201,96,89,38,102,48
1311,Joe Gebbia: How Airbnb designs for trust,Joe Gebbia,2019969,77,321,665,374,135,112,100,144,115,42,3,18,17,22,13
1312,Tim Urban: Inside the mind of a master procrastinator,Tim Urban,14745406,310,1026,2349,722,7445,1957,4387,1864,1770,326,280,65,53,43,22
1313,Jessica Ladd: The reporting system that sexual assault survivors want,Jessica Ladd,1224191,214,179,82,291,162,213,6,129,45,40,26,19,21,8,3
1314,Arthur Brooks: A conservative's plea: Let's work together,Arthur Brooks,1132964,166,354,163,61,39,99,82,60,150,19,24,29,23,16,14
1315,Meron Gribetz: A glimpse of the future through an augmented reality headset,Meron Gribetz,1575381,47,57,174,288,185,134,108,54,22,53,9,18,25,11,21
1316,Adam Foss: A prosecutor's vision for a better justice system,Adam Foss,1723874,101,369,510,630,1159,695,112,202,83,1,17,18,7,19,8
1317,Carol Fishman Cohen: How to get back to work after a career break,Carol Fishman Cohen,1546664,56,280,16,72,143,13,7,23,63,23,20,6,34,20,1
1318,Latif Nasser: You have no idea where camels really come from,Latif Nasser,2272081,87,623,509,198,519,158,87,56,94,27,62,18,21,9,31
1319,Siyanda Mohutsiwa: How young Africans found a voice on Twitter,Siyanda Mohutsiwa,992773,33,267,25,112,52,95,45,54,26,29,2,3,10,0,0
1320,Alex Kipman: A futuristic vision of the age of holograms,Alex Kipman,2224913,125,254,517,343,148,155,270,66,50,51,18,35,9,19,20
1321,Ang?lica Dass: The beauty of human skin in every color,Ang?lica Dass,1961502,93,1024,431,268,97,822,120,86,17,15,198,8,9,64,6
1322,Dan Gross: Why gun violence can't be our new normal,Dan Gross,1096198,335,1545,3090,3024,1298,424,597,13,35,15,27,9,159,11,4
1323,Lisa Nip: How humans could evolve to survive in space,Lisa Nip,1468353,92,299,24,156,59,199,51,189,17,67,13,49,37,12,34
1324,Knut Haanaes: Two reasons companies fail -- and how to avoid them,Knut Haanaes,1743987,23,63,391,291,7,94,16,8,143,76,4,46,18,14,11
1325,Adam Grant: The surprising habits of original thinkers,Adam Grant,6484404,135,1017,1394,2755,314,171,690,343,683,23,90,34,40,73,12
1326,Haley Van Dyck: How a start-up in the White House is changing business as usual,Haley Van Dyck,961158,35,149,171,32,46,22,45,46,17,18,14,27,11,9,23
1327,Parag Khanna: How megacities are changing the map of the world,Parag Khanna,902761,73,364,220,215,97,44,52,50,29,36,24,22,17,17,1
1328,Danielle Feinberg: The magic ingredient that brings Pixar movies to life,Danielle Feinberg,2617414,45,965,85,873,584,324,120,134,92,48,63,15,6,16,14
1329,Tabetha Boyajian: The most mysterious star in the universe,Tabetha Boyajian,2841795,155,410,554,204,52,153,43,50,38,21,23,39,18,42,16
1330,Robert Palmer: The Panama Papers exposed a huge global problem. What's next?,Robert Palmer,1015683,64,245,97,65,74,13,12,38,33,72,9,28,20,10,5
1331,Linus Torvalds: The mind behind Linux,Linus Torvalds,2399273,149,58,539,682,363,206,129,107,18,119,115,54,4,30,5
1332,Hugh Evans: What does it mean to be a citizen of the world?,Hugh Evans,1360404,140,45,859,168,213,220,279,32,20,25,108,31,21,29,9
1333,Stephen Petranek: Your kids might live on Mars. Here's how they'll survive,Stephen Petranek,1419325,139,359,292,348,68,14,11,46,49,264,26,29,36,14,72
1334,Paula Hammond: A new superweapon in the fight against cancer,Paula Hammond,1417316,65,324,143,222,186,58,26,19,3,15,28,8,2,4,6
1335,Astro Teller: The unexpected benefit of celebrating failure,Astro Teller,2300106,45,565,190,170,117,208,83,16,40,81,15,18,16,11,9
1336,Mary Norris: The nit-picking glory of The New Yorker's Comma Queen,Mary Norris,1060918,36,60,61,172,9,66,156,24,26,31,4,3,8,4,2
1337,Christiana Figueres: The inside story of the Paris climate agreement,Christiana Figueres,1031398,107,70,132,79,85,25,167,23,12,66,29,37,3,3,1
1338,Chris Anderson: TED's secret to great public speaking,Chris Anderson,2952041,73,179,902,416,539,266,95,111,12,25,23,14,18,33,39
1339,Joshua Prager: Wisdom from great writers on every year of life,Joshua Prager,1531062,31,77,140,34,197,68,11,14,36,42,102,19,9,19,39
1340,Juan Enriquez: We can reprogram life. How to do it wisely,Juan Enriquez,1973225,77,149,416,29,299,191,40,172,55,51,25,36,16,5,6
1341,Aditi Gupta: A taboo-free way to talk about periods,Aditi Gupta,1428083,35,370,331,275,60,67,81,21,49,86,36,6,8,4,0
1342,Kenneth Lacovara: Hunting for dinosaurs showed me our place in the universe,Kenneth Lacovara,1426970,48,100,394,407,54,129,12,366,95,65,58,27,7,4,4
1343,Shivani Siroya: A smart loan for people with no credit history (yet),Shivani Siroya,1437353,61,169,253,169,308,179,53,90,56,18,9,7,7,11,12
1344,R. Luke DuBois: Insightful human portraits made from data,R. Luke DuBois,1222519,29,360,122,243,92,153,111,16,53,14,26,7,2,3,12
1345,Ameera Harouda: Why I put myself in danger to tell the stories of Gaza,Ameera Harouda,961423,139,135,138,295,259,52,54,30,90,6,24,28,22,17,4
1346,Michael Metcalfe: A provocative way to finance the fight against climate change,Michael Metcalfe,1184083,40,166,16,57,23,29,93,30,38,36,15,14,5,6,0
1347,Riccardo Sabatini: How to read the genome and build a human being,Riccardo Sabatini,1503016,67,465,163,216,58,419,52,178,12,44,5,34,8,6,1
1348,Sarah Gray: How my son's short life made a lasting difference,Sarah Gray,1431262,24,232,98,268,162,60,12,39,15,61,20,8,4,3,0
1349,"Alice Rawsthorn: Pirates, nurses and other rebel designers",Alice Rawsthorn,914011,15,38,54,70,29,61,94,19,4,12,12,4,7,7,5
1350,Dan Pallotta: The dream we haven't dared to dream,Dan Pallotta,1836233,64,504,327,788,37,120,131,39,49,11,37,22,59,24,66
1351,Monica Byrne: A sci-fi vision of love from a 318-year-old hologram,Monica Byrne,876021,120,38,37,23,205,152,42,66,56,19,33,40,11,8,7
1352,Michael Bodekaer: This virtual lab will revolutionize science class,Michael Bodekaer,1132257,74,64,139,270,293,70,56,170,53,53,19,20,2,10,1
1353,Jennifer Kahn: Gene editing can now change an entire species -- forever,Jennifer Kahn,1498103,96,28,495,106,311,122,211,85,20,38,8,32,44,5,3
1354,Uri Hasson: This is your brain on communication,Uri Hasson,1800490,43,498,334,59,144,46,148,20,9,77,8,30,45,25,18
1355,Sanford Biggers: An artist's unflinching look at racial violence,Sanford Biggers,987388,38,151,134,182,54,65,10,22,28,65,24,28,4,65,1
1356,Sangeeta Bhatia: This tiny particle could roam your body to find tumors,Sangeeta Bhatia,766188,28,90,213,47,173,193,172,26,51,32,2,14,6,13,1
1357,Kang Lee: Can you really tell if a kid is lying?,Kang Lee,6406853,107,348,133,109,1018,854,205,733,204,3,342,26,12,9,3
1358,Laura Indolfi: Good news in the fight against pancreatic cancer,Laura Indolfi,1183075,35,56,274,49,102,145,13,43,70,18,3,19,3,3,0
1359,Sebastian Junger: Our lonely society makes it hard to come home from war,Sebastian Junger,768077,68,114,186,117,132,265,235,18,3,6,3,10,3,33,3
1360,Juno Mac: The laws that sex workers really want,Juno Mac,1811102,212,600,572,248,59,387,75,52,62,87,25,23,17,12,14
1361,Trevor Timm: How free is our freedom of the press?,Trevor Timm,1258881,51,297,347,147,27,7,60,76,30,21,6,13,8,16,0
1362,Lidia Yuknavitch: The beauty of being a misfit,Lidia Yuknavitch,2190919,372,1468,1255,1641,57,150,82,105,47,56,207,18,64,44,25
1363,Mariano Sigman: Your words may predict your future mental health,Mariano Sigman,2275945,70,425,291,693,602,25,107,66,44,103,129,45,2,46,12
1364,Zaria Forman: Drawings that show the beauty and fragility of Earth,Zaria Forman,1078782,34,237,453,109,327,79,78,12,29,7,30,13,34,5,0
1365,Joseph Ravenell: How barbershops can keep men healthy,Joseph Ravenell,993232,26,47,154,50,58,117,19,10,17,4,54,4,6,7,3
1366,Adam Driver: My journey from Marine to actor,Adam Driver,3016666,36,251,164,131,14,44,35,14,208,80,79,33,33,5,4
1367,"Sue Desmond-Hellmann: A smarter, more precise way to think about public health",Sue Desmond-Hellmann,929167,39,51,50,64,20,130,38,87,13,13,28,20,8,3,8
1368,Ken Robinson: Do schools kill creativity?,Ken Robinson,47227110,4553,19645,4573,6073,3253,387,242,7346,10581,300,10704,4439,1174,209,24924
1369,Al Gore: Averting the climate crisis,Al Gore,3200520,265,544,139,62,58,258,113,443,413,132,56,268,116,131,203
1370,David Pogue: Simplicity sells,David Pogue,1636292,124,964,45,183,60,104,78,395,230,166,27,146,230,54,142
1371,Majora Carter: Greening the ghetto,Majora Carter,1697550,200,760,291,32,59,105,36,53,380,1070,132,460,230,35,85
1372,Hans Rosling: The best stats you've ever seen,Hans Rosling,12005869,593,3202,1390,942,318,110,72,67,5433,2893,4606,3736,2542,248,61
1373,Tony Robbins: Why we do what we do,Tony Robbins,20685401,672,1102,721,377,301,706,397,285,1038,5211,1350,2423,441,669,335
1374,Julia Sweeney: Letting go of God,Julia Sweeney,3769987,919,477,2484,320,225,277,72,226,438,316,193,311,308,290,61
1375,Joshua Prince-Ramus: Behind the design of Seattle's library,Joshua Prince-Ramus,967741,46,195,98,26,34,26,175,121,153,25,37,63,57,9,5
