,name,main_speaker,views,comments,Funny,Beautiful,Ingenious,Courageous,Longwinded,Confusing,Informative,Fascinating,Unconvincing,Persuasive,Jawdrop,Ok,Obnoxious,Inspiring
1800,Ben Katchor: Comics of bygone New York,Ben Katchor,294396,20,13,28,64,20,21,15,38,12,33,18,10,4,3,1
1801,Alex Tabarrok: How ideas trump crises,Alex Tabarrok,748739,202,267,203,66,197,28,86,253,67,13,36,41,84,12,4
1802,Michael Merzenich: Growing evidence of brain plasticity,Michael Merzenich,1237391,130,276,95,21,18,363,82,30,98,126,66,43,3,16,14
1803,Sarah Jones: A one-woman global village,Sarah Jones,1607397,112,206,511,182,139,20,55,132,158,45,47,12,17,16,10
1804,Laurie Garrett: Lessons from the 1918 flu,Laurie Garrett,425429,92,63,267,21,94,69,35,36,31,26,18,3,7,1,0
1805,Brian Cox: What went wrong at the LHC,Brian Cox,948459,107,9,427,9,32,129,153,70,33,20,31,47,7,19,4
1806,Sean Gourley: The mathematics of war,Sean Gourley,909309,142,401,348,42,366,130,231,45,107,123,22,141,31,15,7
1807,Mae Jemison: Teach arts and sciences together,Mae Jemison,744257,99,126,243,83,86,17,67,107,68,42,34,10,14,55,18
1808,Tom Shannon: Anti-gravity sculpture,Tom Shannon,1069653,80,187,149,63,61,15,75,123,71,139,16,18,3,5,0
1809,Al Gore: What comes after An Inconvenient Truth?,Al Gore,775430,846,166,64,123,43,302,263,73,40,76,26,15,17,10,5
1810,Louise Fresco: We need to feed the whole world,Louise Fresco,922158,277,212,60,94,72,7,179,108,49,209,48,74,253,27,7
1811,Seth Godin: The tribes we lead,Seth Godin,1985679,266,810,1604,296,195,211,115,62,379,393,105,153,39,22,68
1812,Eric Lewis: Chaos and harmony on piano,Eric Lewis,391427,138,84,54,27,32,11,107,54,18,39,35,7,25,5,1
1813,"Hans Rosling: Insights on HIV, in stunning data visuals",Hans Rosling,904813,125,96,115,42,491,258,36,247,68,147,8,7,20,9,21
1814,Nandan Nilekani: Ideas for India's future,Nandan Nilekani,792495,133,354,57,259,68,34,174,31,29,85,37,16,28,16,5
1815,Naturally 7: A full-band beatbox,Naturally 7,1485196,88,424,267,401,323,154,27,14,120,66,12,12,6,17,0
1816,Ray Anderson: The business logic of sustainability,Ray Anderson,881842,109,84,533,74,79,174,254,144,60,30,35,61,7,14,4
1817,Dan Ariely: Are we in control of our own decisions?,Dan Ariely,4934167,324,1194,2031,2309,97,2851,1448,1069,555,27,149,139,44,14,28
1818,Mary Roach: 10 things you didn't know about orgasm,Mary Roach,22270883,354,363,4166,519,1752,2231,100,345,715,184,212,154,209,213,110
1819,Carolyn Porco: Could a Saturn moon harbor life?,Carolyn Porco,884578,181,499,276,65,99,19,11,45,44,39,12,4,6,4,5
1820,Yves Behar: A supercharged motorcycle design,Yves Behar,556657,62,30,26,35,16,44,93,28,34,53,12,8,6,6,3
1821,Joachim de Posada: Don't eat the marshmallow!,Joachim de Posada,2613400,591,238,902,494,32,135,265,467,322,55,47,8,28,22,21
1822,Jay Walker: The world's English mania,Jay Walker,4289903,588,150,354,355,369,249,595,268,96,103,43,48,26,45,87
1823,"Michelle Obama: A passionate, personal case for education",Michelle Obama,1026589,313,541,56,128,114,132,105,128,142,47,25,13,54,12,13
1824,Jonathan Drori: Why we're storing billions of seeds,Jonathan Drori,555846,103,140,272,68,13,89,141,31,6,46,33,34,0,0,0
1825,"Kaki King: Playing ""Pink Noise"" on guitar",Kaki King,1054415,287,561,238,146,245,399,32,55,26,30,10,23,30,7,0
1826,Liz Coleman: A call to reinvent liberal arts education,Liz Coleman,589931,323,152,100,47,77,290,81,412,158,45,35,29,47,54,4
1827,Ray Kurzweil: A university for the coming singularity,Ray Kurzweil,908923,145,123,338,13,205,89,213,40,72,34,71,58,20,16,11
1828,Yann Arthus-Bertrand: A wide-angle view of fragile Earth,Yann Arthus-Bertrand,751889,143,29,44,14,16,179,397,30,266,93,130,89,103,43,4
1829,Felix Dennis: Odes to vice and consequences,Felix Dennis,296294,55,28,24,51,88,72,24,28,11,12,55,55,9,2,1
1830,Pete Alcorn: The world in 2200,Pete Alcorn,493966,126,87,43,53,376,37,17,113,18,162,33,29,4,14,13
1831,John La Grou: A plug for smart power outlets,John La Grou,606042,172,110,588,112,48,127,214,77,70,6,10,8,9,3,6
1832,Kevin Surace: Eco-friendly drywall,Kevin Surace,352169,69,35,11,156,148,17,55,122,53,47,28,5,24,4,11
1833,Nancy Etcoff: Happiness and its surprises,Nancy Etcoff,1587823,112,448,219,35,179,113,84,98,64,169,25,16,15,43,13
1834,Robert Full: Learning from the gecko's tail,Robert Full,665959,72,268,567,231,166,55,265,95,61,3,20,4,7,5,0
1835,Richard St. John: Success is a continuous journey,Richard St. John,3661633,182,1278,90,240,59,315,12,307,346,128,15,177,14,20,101
1836,Jane Poynter: Life in Biosphere 2,Jane Poynter,843719,103,407,111,422,315,41,135,67,71,43,47,34,89,62,19
1837,Clay Shirky: How social media can make history,Clay Shirky,1677738,344,798,124,476,425,355,31,79,37,81,15,40,13,25,17
1838,Diane Benscoter: How cults rewire the brain,Diane Benscoter,1076279,642,47,364,129,300,136,452,269,138,93,52,65,10,12,13
1839,"Catherine Mohr: Surgery's past, present and robotic future",Catherine Mohr,680984,110,379,460,182,164,238,62,44,111,62,17,31,3,18,5
1840,Qi Zhang: An electrifying organ performance,Qi Zhang,803691,135,326,269,105,204,85,90,25,40,53,33,10,4,8,4
1841,Philip Zimbardo: The psychology of time,Philip Zimbardo,1580239,166,389,493,81,188,26,87,336,47,634,142,33,19,22,37
1842,Paul Collier: New rules for rebuilding a broken nation,Paul Collier,406530,93,162,41,27,184,26,17,81,23,7,4,44,10,6,0
1843,Katherine Fulton: You are the future of philanthropy,Katherine Fulton,437529,42,38,236,30,17,76,84,27,45,60,13,24,7,8,3
1844,Ray Zahab: My trek to the South Pole,Ray Zahab,310446,60,57,8,196,165,24,104,16,65,8,24,24,15,3,2
1845,Arthur Benjamin: Teach statistics before calculus!,Arthur Benjamin,2175141,398,282,1116,159,499,169,24,183,490,253,60,193,26,42,74
1846,Gever Tulley: Life lessons through tinkering,Gever Tulley,1149257,172,58,161,214,544,202,82,104,89,46,75,7,3,1,1
1847,Daniel Libeskind: 17 words of architectural inspiration,Daniel Libeskind,784642,423,128,447,244,43,262,107,44,885,84,70,1361,69,17,18
1848,Eames Demetrios: The design genius of Charles + Ray Eames,Eames Demetrios,594111,26,94,65,38,75,53,36,58,25,61,12,8,10,3,2
1849,Tom Wujec: 3 ways the brain creates meaning,Tom Wujec,1022457,101,430,92,97,5,41,205,150,138,76,115,10,25,18,5
1850,Sophal Ear: Escaping the Khmer Rouge,Sophal Ear,501090,80,285,210,33,129,44,66,6,49,4,5,5,5,1,3
1851,Kary Mullis: A next-gen cure for killer infections,Kary Mullis,624544,144,219,510,68,244,38,118,18,154,121,22,31,15,7,2
1852,Stewart Brand: 4 environmental 'heresies',Stewart Brand,646378,473,328,511,212,273,72,154,113,40,53,7,64,43,56,5
1853,Olafur Eliasson: Playing with space and light,Olafur Eliasson,522578,54,73,78,95,106,95,90,96,26,134,4,36,56,20,13
1854,Daniel Kraft: A better way to harvest bone marrow,Daniel Kraft,462619,81,228,129,144,393,37,67,27,20,2,5,2,22,3,3
1855,Jim Fallon: Exploring the mind of a killer,Jim Fallon,2064604,155,217,151,316,461,453,61,19,31,65,55,51,48,19,18
1856,Nina Jablonski: Skin color is an illusion,Nina Jablonski,996694,301,395,640,59,214,79,212,57,193,39,209,33,122,84,15
1857,Gordon Brown: Wiring a web for global good,Gordon Brown,811914,514,711,430,87,19,163,82,51,72,87,199,22,172,14,59
1858,"Alain de Botton: A kinder, gentler philosophy of success",Alain de Botton,5790615,471,633,3458,1759,1173,662,1393,985,613,207,246,70,65,35,53
1859,Golan Levin: Art that looks back at you,Golan Levin,771144,85,20,22,32,253,223,210,84,137,75,14,63,12,40,10
1860,Elaine Morgan: I believe we evolved from aquatic apes,Elaine Morgan,1038576,621,371,278,70,646,155,457,21,211,531,504,175,36,1031,2194
1861,Willard Wigan: Hold your breath for micro-sculpture,Willard Wigan,640722,103,114,118,197,404,287,162,62,12,11,97,42,5,6,9
1862,Michael Pritchard: How to make filthy water drinkable,Michael Pritchard,3573198,752,697,1004,869,650,1426,540,156,23,97,42,34,73,21,125
1863,Paul Romer: Why the world needs charter cities,Paul Romer,572392,403,300,182,282,86,131,49,199,202,40,18,42,34,3,5
1864,Janine Benyus: Biomimicry in action,Janine Benyus,1118954,141,408,52,227,217,660,280,531,48,31,123,32,25,22,3
1865,Emmanuel Jal: The music of a war child,Emmanuel Jal,776516,210,550,237,362,140,36,76,61,77,8,18,19,10,9,5
1866,Dan Pink: The puzzle of motivation,Dan Pink,18830983,1094,3810,4278,4772,4797,184,133,152,483,1191,489,1067,825,348,86
1867,Eric Giler: A demo of wireless electricity,Eric Giler,2088983,428,491,94,900,708,325,136,583,74,42,23,6,29,42,20
1868,Hans Rosling: Let my dataset change your mindset,Hans Rosling,1471039,122,613,800,472,245,415,12,182,225,67,46,12,26,11,6
1869,Natasha Tsakos: A multimedia theatrical adventure,Natasha Tsakos,389813,123,67,175,166,125,134,27,59,66,118,68,51,46,14,17
1870,"Cary Fowler: One seed at a time, protecting the future of food",Cary Fowler,679728,99,74,235,185,336,227,72,45,54,31,48,11,30,17,5
1871,Joshua Silver: Adjustable liquid-filled eyeglasses,Joshua Silver,751452,118,156,516,207,72,26,67,127,65,38,10,34,9,19,11
1872,"Geoff Mulgan: Post-crash, investing in a better world",Geoff Mulgan,308233,91,123,58,94,74,43,98,24,6,21,18,2,26,11,5
1873,Evan Grant: Making sound visible through cymatics,Evan Grant,811565,125,306,352,8,75,184,164,92,12,22,85,50,9,6,19
1874,Steve Truglia: A leap from the edge of space,Steve Truglia,571893,60,19,96,23,67,76,230,49,43,17,25,19,7,10,6
1875,James Balog: Time-lapse proof of extreme ice loss,James Balog,914170,288,457,43,251,366,66,41,83,133,356,30,84,18,10,1
1876,Lewis Pugh: How I swam the North Pole,Lewis Pugh,689476,110,208,328,342,36,91,22,25,14,33,8,17,50,17,0
1877,Rebecca Saxe: How we read each other's minds,Rebecca Saxe,2856240,386,356,1274,72,21,263,1348,253,383,221,76,61,280,118,85
1878,Vishal Vaid: Hypnotic South Asian improv music,Vishal Vaid,414396,146,68,73,41,171,46,102,49,52,18,10,11,8,18,0
1879,Misha Glenny: How global crime networks work,Misha Glenny,891314,91,564,127,171,212,281,39,39,42,15,37,78,20,15,4
1880,Bjarke Ingels: 3 warp-speed architecture tales,Bjarke Ingels,2129938,227,430,816,629,540,144,365,269,32,82,80,12,18,13,7
1881,John Lloyd: An inventory of the invisible,John Lloyd,1159134,108,877,289,105,41,235,18,29,26,194,85,181,39,35,9
1882,Oliver Sacks: What hallucination reveals about our minds,Oliver Sacks,4233352,328,2032,190,175,182,344,2562,465,175,160,246,118,26,26,15
1883,"Imogen Heap: ""Wait It Out""",Imogen Heap,883282,91,54,560,104,25,149,49,19,22,8,10,19,8,5,1
1884,Jonathan Zittrain: The Web as random acts of kindness,Jonathan Zittrain,717483,96,22,237,364,156,251,68,12,9,64,30,47,16,40,434
1885,Evgeny Morozov: How the Net aids dictatorships,Evgeny Morozov,430276,110,31,28,163,62,14,114,15,115,55,30,48,17,19,0
1886,William Kamkwamba: How I harnessed the wind,William Kamkwamba,2161908,292,2576,486,851,294,522,385,122,95,10,47,15,82,7,74
1887,Taryn Simon: Photographs of secret sites,Taryn Simon,1581054,171,213,284,821,341,275,363,598,154,202,189,74,73,35,17
1888,Jacqueline Novogratz: A third way to think about aid,Jacqueline Novogratz,436147,52,24,92,122,29,232,46,43,32,22,23,26,5,10,3
1889,Parag Khanna: Mapping the future of countries,Parag Khanna,935859,185,335,681,289,143,129,43,169,51,84,55,42,8,36,19
1890,Tim Brown: Designers -- think big!,Tim Brown,1340175,64,202,77,19,522,13,141,30,284,158,44,6,40,83,1
1891,Karen Armstrong: Let's revive the Golden Rule,Karen Armstrong,732390,311,46,95,141,95,431,144,206,71,163,55,13,14,15,4
1892,Garik Israelian: How spectroscopy could reveal alien life,Garik Israelian,593547,70,240,247,79,70,68,66,22,28,12,28,20,13,9,3
1893,Stefan Sagmeister: The power of time off,Stefan Sagmeister,2956967,158,913,192,149,66,161,178,180,224,80,216,29,123,42,32
1894,Carolyn Steel: How food shapes our cities,Carolyn Steel,1014285,111,327,474,219,45,51,100,79,247,45,15,12,36,36,43
1895,David Logan: Tribal leadership,David Logan,1404586,248,333,597,341,64,115,396,52,134,128,48,38,45,59,30
1896,Chimamanda Ngozi Adichie: The danger of a single story,Chimamanda Ngozi Adichie,13298341,1155,5607,9566,2817,109,3002,2687,948,78,713,2983,103,744,333,85
1897,Beau Lotto: Optical illusions show how we see,Beau Lotto,5006241,234,128,1429,241,896,290,175,357,347,283,52,141,206,29,13
1898,"Sam Martin: Claim your ""manspace""",Sam Martin,739428,149,144,168,112,34,97,167,42,34,49,35,5,16,13,9
1899,Eric Sanderson: New York -- before the City,Eric Sanderson,1431255,57,74,229,230,268,70,80,367,100,37,16,15,20,8,8
1900,"David Hanson: Robots that ""show emotion""",David Hanson,906262,178,267,107,95,166,174,12,6,44,89,13,9,10,24,21
1901,Rory Sutherland: Life lessons from an ad man,Rory Sutherland,2882836,286,843,2306,794,872,776,884,145,32,65,23,19,38,45,74
1902,Henry Markram: A brain in a supercomputer,Henry Markram,1180127,343,58,368,187,540,318,73,47,180,89,26,129,80,27,6
1903,Julian Treasure: The 4 ways sound affects us,Julian Treasure,1557795,184,100,251,544,117,911,394,94,50,13,114,19,18,12,5
1904,John Gerzema: The post-crisis consumer,John Gerzema,760493,133,94,286,157,40,98,94,24,136,18,7,29,20,11,8
1905,Paul Debevec: Animating a photo-real digital face,Paul Debevec,748862,89,163,13,186,226,36,139,6,29,79,29,9,8,3,3
1906,Itay Talgam: Lead like the great conductors,Itay Talgam,2890058,207,953,1522,630,224,906,254,61,31,306,215,40,30,27,12
1907,Marc Koska: 1.3m reasons to re-invent the syringe,Marc Koska,629018,233,297,177,55,103,172,59,493,27,26,28,2,5,4,0
1908,Ian Goldin: Navigating our global future,Ian Goldin,1072435,112,41,96,112,113,85,107,191,38,28,10,28,10,5,6
1909,David Deutsch: A new way to explain explanation,David Deutsch,938937,270,399,196,256,71,105,59,338,167,23,149,45,41,26,25
1910,Rachel Armstrong: Architecture that repairs itself?,Rachel Armstrong,1095398,156,338,376,93,86,198,43,232,51,230,58,42,37,92,5
1911,Becky  Blanton: The year I was homeless,Becky  Blanton,1098346,259,567,75,676,90,103,154,120,15,140,46,33,31,37,7
1912,"Marcus du Sautoy: Symmetry, reality's riddle",Marcus du Sautoy,1010292,72,322,116,116,32,262,130,76,65,34,39,97,12,31,3
1913,Matthew White: The modern euphonium,Matthew White,771962,46,43,70,48,123,68,43,33,21,49,36,30,4,6,16
1914,Stefana Broadbent: How the Internet enables intimacy,Stefana Broadbent,1198897,152,325,184,117,61,36,76,124,33,31,115,15,17,16,8
1915,Cameron Sinclair: The refugees of boom-and-bust,Cameron Sinclair,411183,61,165,148,115,43,36,6,14,11,5,6,5,1,0,0
1916,Rachel Pike: The science behind a climate headline,Rachel Pike,470615,124,108,260,28,76,36,51,38,16,67,13,22,12,17,21
1917,Edward Burtynsky: Photographing the landscape of oil,Edward Burtynsky,480142,75,155,119,50,68,69,88,34,97,15,7,32,19,7,0
1918,Cynthia Schneider: The surprising spread of Idol TV,Cynthia Schneider,441609,70,13,28,252,143,92,16,17,54,22,14,3,54,15,10
1919,Pranav Mistry: The thrilling potential of SixthSense technology,Pranav Mistry,16097077,1329,8416,4743,4403,4702,1904,535,663,761,171,83,108,165,85,341
1920,Mathieu Lehanneur: Science-inspired design,Mathieu Lehanneur,431307,50,98,63,153,23,113,51,22,71,57,66,36,20,20,10
1921,Fields Wicker-Miurin: Learning from leadership's missing manual,Fields Wicker-Miurin,956175,55,85,63,80,129,99,44,272,51,56,42,16,7,5,0
1922,Devdutt Pattanaik: East vs. West -- the myths that mystify,Devdutt Pattanaik,1683308,477,504,350,1014,460,172,1178,631,75,273,136,33,40,70,57
1923,Tom Wujec: Learn to use the 13th-century astrolabe,Tom Wujec,569026,88,270,316,124,105,77,97,19,24,26,24,14,13,6,8
1924,Hans Rosling: Asia's rise -- how and when,Hans Rosling,1738069,276,773,724,384,651,296,480,45,100,298,86,16,7,59,7
1925,Rob Hopkins: Transition to a world without oil,Rob Hopkins,807653,199,90,30,260,341,227,56,98,17,30,64,72,91,19,3
1926,Magnus Larsson: Turning dunes into architecture,Magnus Larsson,666784,148,50,469,265,280,129,114,88,95,124,113,14,16,10,11
1927,Mallika Sarabhai: Dance to change the world,Mallika Sarabhai,481834,595,141,68,110,219,41,112,53,94,67,122,33,45,70,24
1928,Shashi Tharoor: Why nations should pursue soft power,Shashi Tharoor,1437808,402,743,1148,278,27,31,21,374,591,464,166,102,163,82,6
1929,Gordon Brown: Global ethic vs. national interest,Gordon Brown,512817,193,74,101,24,74,21,86,52,40,28,17,43,10,11,0
1930,Andrea Ghez: The hunt for a supermassive black hole,Andrea Ghez,763145,146,128,41,139,58,101,394,371,90,41,55,76,24,17,44
1931,Anupam Mishra: The ancient ingenuity of water harvesting,Anupam Mishra,833308,150,49,315,348,504,154,379,188,31,114,9,165,9,6,3
1932,Scott Kim: The art of puzzles,Scott Kim,517779,39,118,22,130,103,102,49,52,16,32,19,38,16,17,0
1933,Sunitha Krishnan: The fight against sex slavery,Sunitha Krishnan,2543750,552,1327,407,1880,590,596,76,26,99,11,11,30,9,7,2
1934,Rory  Bremner: A one-man world summit,Rory  Bremner,1112000,69,517,28,25,129,60,14,26,48,29,19,57,11,6,15
1935,Marc Pachter: The art of the interview,Marc Pachter,716979,56,116,45,31,88,180,135,17,74,72,13,21,29,5,18
1936,Thulasiraj Ravilla: How low-cost eye care can be world-class,Thulasiraj Ravilla,297107,64,75,170,54,81,34,34,2,2,40,5,19,6,3,0
1937,Shereen El Feki: Pop culture in the Arab world,Shereen El Feki,483137,171,134,138,197,56,94,7,37,58,34,11,35,11,20,15
1938,Loretta Napoleoni: The intricate economics of terrorism,Loretta Napoleoni,639995,97,165,477,71,317,176,24,155,50,37,24,38,44,10,16
1939,Ryan Lobo: Photographing the hidden story,Ryan Lobo,541603,96,176,39,92,305,66,143,29,13,32,3,12,4,5,5
1940,Alexis Ohanian: How to make a splash in social media,Alexis Ohanian,2066733,174,250,221,705,325,168,105,47,322,21,51,17,47,33,13
1941,Charles Anderson: Dragonflies that fly across oceans,Charles Anderson,553253,56,2,323,294,63,69,55,26,27,16,58,4,16,3,0
1942,James Geary: Metaphorically speaking,James Geary,819664,115,111,153,402,65,42,154,265,44,101,59,17,11,16,3
1943,Shaffi Mather: A new way to fight corruption,Shaffi Mather,497172,140,254,246,44,140,64,7,52,38,20,21,21,8,18,3
1944,Steven  Cowley: Fusion is energy's future,Steven  Cowley,706235,184,323,179,158,69,28,12,51,12,6,119,31,49,14,2
1945,Asher Hasan: My message of peace from Pakistan,Asher Hasan,415223,168,170,71,28,95,34,39,32,25,4,20,5,3,11,4
1946,Michael Sandel: What's the right thing to do?,Michael Sandel,393459,307,132,56,291,205,83,12,31,126,19,58,39,38,32,9
1947,Bertrand Piccard: My solar-powered adventure,Bertrand Piccard,778978,93,604,59,184,83,186,53,146,64,53,43,23,21,10,10
1948,Vilayanur Ramachandran: The neurons that shaped civilization,Vilayanur Ramachandran,1939385,380,436,776,1251,238,506,91,271,29,63,31,32,8,8,5
1949,Nick Veasey: Exposing the invisible,Nick Veasey,1780196,58,249,309,63,55,8,84,97,113,107,26,58,6,35,19
1950,Dan Buettner: How to live to be 100+,Dan Buettner,3157446,304,861,1181,671,1136,122,132,43,128,18,54,27,47,53,13
1951,Romulus Whitaker: The real danger lurking in the water,Romulus Whitaker,397719,42,111,72,67,38,114,40,56,19,5,14,7,7,5,6
1952,Herbie Hancock: An all-star set,Herbie Hancock,652315,74,14,51,145,80,68,84,16,11,16,8,20,5,5,8
1953,Randy Pausch: Really achieving your childhood dreams,Randy Pausch,564781,124,299,892,200,41,88,172,264,107,80,10,5,41,15,7
1954,Robert Sapolsky: The uniqueness of humans,Robert Sapolsky,572845,204,40,564,342,161,445,532,92,135,134,11,9,14,7,37
1955,Matt Weinstein: What Bernie Madoff couldn't steal from me,Matt Weinstein,149818,87,246,94,171,42,64,11,42,22,56,47,24,6,7,34
1956,"Kartick Satyanarayan: How we rescued the ""dancing"" bears""",Kartick Satyanarayan,415566,93,113,34,57,83,252,133,43,25,24,5,6,3,1,0
1957,"Kiran Sethi: Kids, take charge",Kiran Sethi,1417163,277,1287,99,246,292,301,131,321,58,41,138,9,13,14,12
1958,"Lalitesh Katragadda: Making maps to fight disaster, build economies",Lalitesh Katragadda,359942,43,76,116,45,51,32,36,8,13,5,6,8,2,3,0
1959,Charles Fleischer: All things are Moleeds,Charles Fleischer,1055904,120,78,782,47,24,40,24,80,86,174,55,41,91,20,11
1960,David Blaine: How I held my breath for 17 minutes,David Blaine,15601385,296,913,897,61,738,722,52,75,236,111,38,97,147,43,17
1961,Ravin Agrawal: 10 young Indian artists to watch,Ravin Agrawal,437800,35,85,55,75,11,44,59,11,8,4,2,9,7,11,2
1962,Anthony Atala: Growing new organs,Anthony Atala,1705132,151,473,358,504,264,310,36,57,5,34,33,5,6,6,9
1963,"Sivamani: Rhythm is everything, everywhere",Sivamani,556163,104,46,182,120,161,137,48,103,17,20,32,31,12,25,6
1964,Taylor Mali: What teachers make,Taylor Mali,676741,177,825,351,202,75,253,219,25,49,39,91,120,11,140,18
1965,Bill Davenhall: Your health depends on where you live,Bill Davenhall,761716,111,74,412,176,77,80,109,15,71,25,17,8,11,7,5
1966,Joshua Prince-Ramus: Building a theater that remakes itself,Joshua Prince-Ramus,717531,37,22,31,176,105,32,113,45,52,43,12,10,15,17,1
1967,Eve Ensler: Embrace your inner girl,Eve Ensler,1224278,472,549,870,160,71,111,152,434,192,24,32,111,31,44,66
1968,Jane Chen: A warm embrace that saves lives,Jane Chen,702550,144,125,370,299,41,115,129,34,54,44,3,5,6,2,1
1969,"Derek Sivers: Weird, or just different?",Derek Sivers,2835976,238,924,558,274,758,513,158,333,87,10,17,86,9,34,13
1970,JK Rowling: The fringe benefits of failure,JK Rowling,1406151,356,18,3436,969,1288,498,745,98,422,322,371,245,14,18,40
1971,Sendhil Mullainathan: Solving social problems with a nudge,Sendhil Mullainathan,495585,113,14,125,224,23,25,14,200,129,28,93,26,51,79,17
1972,Jamie Heywood: The big idea my brother inspired,Jamie Heywood,528451,95,228,108,199,69,87,97,29,58,8,2,6,8,13,4
1973,George Whitesides: A lab the size of a postage stamp,George Whitesides,496827,68,313,107,144,33,120,50,16,11,74,20,10,24,9,11
1974,David Agus: A new strategy in the war on cancer,David Agus,696319,171,121,118,177,52,10,42,59,44,25,31,104,34,8,1
1975,"Tom Shannon, John Hockenberry: The painter and the pendulum","Tom Shannon, John Hockenberry",433879,36,143,26,119,83,68,21,23,28,16,20,12,4,0,0
1976,Peter Eigen: How to expose the corrupt,Peter Eigen,741625,196,349,494,77,96,293,387,56,65,21,21,23,9,9,5
1977,Jamie Oliver: Teach every child about food,Jamie Oliver,7638978,1137,1413,3316,1547,4779,359,2606,99,844,297,470,249,113,109,69
1978,Blaise Ag?_era y Arcas: Augmented-reality maps,Blaise Ag?_era y Arcas,1718568,209,849,459,303,90,591,244,123,28,103,16,52,31,12,8
1979,David Cameron: The next age of government,David Cameron,656762,250,233,286,272,69,109,56,241,88,39,60,15,28,21,25
1980,Aimee Mullins: The opportunity of adversity,Aimee Mullins,2054164,266,94,56,158,1125,513,145,249,165,562,15,47,85,29,10
1981,Bill Gates: Innovating to zero!,Bill Gates,4329332,948,181,962,263,795,141,728,221,367,224,39,80,38,61,78
1982,Kevin Kelly: Technology's epic story,Kevin Kelly,540897,142,189,129,65,141,33,55,175,78,101,6,15,30,27,46
1983,Philip K. Howard: Four ways to fix a broken legal system,Philip K. Howard,610454,277,120,758,263,269,101,107,443,37,54,14,17,17,17,19
1984,Eric Topol: The wireless future of medicine,Eric Topol,710710,110,228,250,87,139,113,12,33,80,5,16,14,12,7,2
1985,Temple Grandin: The world needs all kinds of minds,Temple Grandin,4375111,383,843,2290,1432,341,1357,31,542,312,302,141,45,99,39,27
1986,Pawan Sinha: How brains learn to see,Pawan Sinha,840223,68,111,217,19,216,24,332,48,7,63,75,75,7,2,2
1987,Raghava KK: My 5 lives as an artist,Raghava KK,674090,189,86,402,612,282,210,229,39,13,53,43,15,13,9,24
1988,Daniel Kahneman: The riddle of experience vs. memory,Daniel Kahneman,3841631,425,234,1417,360,1169,615,543,29,161,85,64,62,85,42,7
1989,"Harsha Bhogle: The rise of cricket, the rise of India",Harsha Bhogle,567000,90,178,12,149,28,173,21,46,87,14,30,44,15,24,9
1990,Gary Flake: Is Pivot a turning point for web exploration?,Gary Flake,654080,112,141,271,229,69,120,37,50,232,67,9,11,4,2,0
1991,James Cameron: Before Avatar ... a curious boy,James Cameron,1890066,197,456,1033,89,158,228,86,164,138,48,70,32,24,8,56
1992,"The LXD: In the Internet age, dance evolves ...",The LXD,2797058,216,1093,543,805,162,454,27,103,36,78,26,27,32,27,13
1993,Srikumar Rao: Plug into your hard-wired happiness,Srikumar Rao,971594,258,70,102,1374,262,92,120,481,72,237,402,132,116,11,14
1994,Tim Berners-Lee: The year open data went worldwide,Tim Berners-Lee,680486,90,278,219,171,144,19,87,89,31,14,29,11,9,7,4
1995,Gary Lauder's new traffic sign: Take Turns,Gary Lauder's new traffic sign,575346,210,216,215,165,205,59,63,16,52,19,71,8,5,8,4
1996,Dan Barber: How I fell in love with a fish,Dan Barber,1974007,317,324,1227,681,562,746,118,275,694,191,47,52,34,7,16
1997,Eric Mead: The magic of the placebo,Eric Mead,1022426,164,141,97,74,123,49,208,70,102,60,125,35,18,26,6
1998,Mark Roth: Suspended animation is within our grasp,Mark Roth,708408,101,52,300,399,517,126,165,69,18,27,17,9,16,10,6
1999,Eric Dishman: Take health care off the mainframe,Eric Dishman,384626,82,16,19,24,116,202,62,145,28,68,28,14,4,3,0
2000,Jane McGonigal: Gaming can make a better world,Jane McGonigal,4573252,1309,1541,2421,1139,453,118,547,1137,774,481,221,511,185,93,112
2001,Ken Kamler: Medical miracle on Everest,Ken Kamler,719238,104,180,137,45,57,136,29,35,32,8,9,5,6,139,0
2002,Shekhar Kapur: We are the stories we tell ourselves,Shekhar Kapur,733293,73,66,12,197,92,32,139,117,65,70,55,42,22,20,5
2003,Sam Harris: Science can answer moral questions,Sam Harris,3433437,3356,923,2090,1029,1246,612,128,259,1316,348,149,557,100,157,215
2004,Juliana Machado Ferreira: The fight to end rare-animal trafficking in Brazil,Juliana Machado Ferreira,320717,76,53,102,31,132,66,14,40,6,6,4,12,3,2,0
2005,Alan Siegel: Let's simplify legal jargon!,Alan Siegel,876649,146,476,104,227,224,312,79,19,15,2,84,9,10,5,3
2006,Joel Levine: Why we need to go back to Mars,Joel Levine,622046,180,133,318,265,222,145,107,21,44,23,14,3,14,27,17
2007,"Robert Gupta: Music is medicine, music is sanity",Robert Gupta,1163387,180,235,610,74,507,85,69,36,32,80,30,55,11,8,6
2008,Kevin Bales: How to combat modern slavery,Kevin Bales,857400,270,513,282,369,368,323,15,89,26,14,28,30,5,24,3
2009,Shukla Bose: Teaching one child at a time,Shukla Bose,940686,152,543,67,122,10,12,26,149,75,53,41,26,11,7,0
